{
  "agentControl": {
    "activeLease": null,
    "enabled": true,
    "lastDecision": null,
    "lastErrorCode": null,
    "policy": {
      "enabled": true,
      "maxDurationSeconds": 1800,
      "maximumAllowedRPMPercent": 80,
      "minimumAgentRPMPercent": 45,
      "prepareCooldownSeconds": 30
    }
  },
  "agentControlStatusError": null,
  "appPreferences": {
    "readError": null,
    "startupMode": "Curve",
    "startupModeSource": "persisted"
  },
  "daemonRuntime": {
    "installedDaemonPath": "/Library/PrivilegedHelperTools/tech.reidar.vifty.daemon",
    "installedDaemonPresent": false,
    "installedDaemonSHA256": null,
    "expectedDaemonPath": null,
    "expectedDaemonPresent": false,
    "expectedDaemonSHA256": null,
    "matchesExpectedDaemon": null,
    "matchRequired": false
  },
  "checks": [
    {
      "id": "daemonSnapshotAvailable",
      "message": "Daemon hardware snapshot is available.",
      "passed": true,
      "severity": "info"
    },
    {
      "id": "agentControlStatusAvailable",
      "message": "Daemon agent-control status is available.",
      "passed": true,
      "severity": "info"
    },
    {
      "id": "daemonControlPathReady",
      "message": "Daemon-backed control path is ready for bounded agent cooling requests.",
      "passed": true,
      "severity": "error"
    },
    {
      "id": "daemonRuntimeMatchesExpected",
      "message": "Current-build daemon runtime parity is not required for this diagnose context.",
      "passed": true,
      "severity": "info"
    },
    {
      "id": "supportedHardware",
      "message": "Apple Silicon MacBook Pro hardware detected.",
      "passed": true,
      "severity": "error"
    },
    {
      "id": "agentControlEnabled",
      "message": "Agent cooling policy is enabled in the daemon.",
      "passed": true,
      "severity": "error"
    },
    {
      "id": "temperatureSensorsPresent",
      "message": "2 temperature sensor(s) available.",
      "passed": true,
      "severity": "error"
    },
    {
      "id": "controllableFansPresent",
      "message": "2 controllable fan(s) available.",
      "passed": true,
      "severity": "error"
    },
    {
      "id": "fanIDsValid",
      "message": "Controllable fan IDs are valid.",
      "passed": true,
      "severity": "error"
    },
    {
      "id": "fanIDsUnique",
      "message": "Controllable fan IDs are unique.",
      "passed": true,
      "severity": "error"
    },
    {
      "id": "fanRangesValid",
      "message": "Controllable fan RPM ranges are valid.",
      "passed": true,
      "severity": "error"
    },
    {
      "id": "thermalPressureSafe",
      "message": "Thermal pressure is nominal.",
      "passed": true,
      "severity": "info"
    },
    {
      "id": "activeLeaseClear",
      "message": "No active agent cooling lease.",
      "passed": true,
      "severity": "warning"
    },
    {
      "id": "manualControlClear",
      "message": "Vifty/manual fan control appears active; restore Auto once, then re-run diagnose. Vifty default startup mode is Curve; switch Vifty/default mode to Auto before requesting agent cooling.",
      "passed": false,
      "severity": "warning"
    },
    {
      "id": "fanModeTelemetry",
      "message": "Fan hardware mode telemetry is available.",
      "passed": true,
      "severity": "info"
    }
  ],
  "controllableFanCount": 2,
  "daemonControlPathReady": true,
  "daemonSnapshotError": null,
  "fanCount": 2,
  "fans": [
    {
      "controllable": true,
      "currentRPM": 3300,
      "hardwareMode": "Forced",
      "hardwareModeKey": "F0Md",
      "hardwareModeRawValue": 1,
      "id": 0,
      "maximumRPM": 6800,
      "minimumRPM": 1400,
      "name": "Left Fan",
      "targetRPM": 3400
    },
    {
      "controllable": true,
      "currentRPM": 3350,
      "hardwareMode": "Forced",
      "hardwareModeKey": "F1md",
      "hardwareModeRawValue": 1,
      "id": 1,
      "maximumRPM": 7200,
      "minimumRPM": 1500,
      "name": "Right Fan",
      "targetRPM": 3400
    }
  ],
  "generatedAt": 700000000,
  "highestTemperatureCelsius": 67.2,
  "isAppleSilicon": true,
  "isMacBookPro": true,
  "manualControlActive": true,
  "modelIdentifier": "MacBookPro18,3",
  "recommendedAgentAction": "restoreAutoBeforeRequestingCooling",
  "recommendedRecoveryAction": "restoreAutoBeforeRetry",
  "safeToRequestCooling": false,
  "schemaVersion": 1,
  "state": "degraded",
  "temperatureSensorCount": 2,
  "temperatureSensors": [
    {
      "celsius": 67.2,
      "id": "Tp09",
      "name": "CPU Proximity",
      "source": "SMC"
    },
    {
      "celsius": 50.1,
      "id": "hid-0",
      "name": "HID Temperature 0",
      "source": "HID"
    }
  ],
  "thermalPressure": "nominal",
  "failedCheckIDs": [
    "manualControlClear"
  ],
  "coolingBlockerIDs": [
    "manualControlClear"
  ]
}
